source_id,url,title,source_class,publisher,retrieved_at,scope,claim_supported,limitations
src.samsung.galaxy_s23_spec,https://www.samsung.com/ae/business/smartphones/galaxy-s/galaxy-s23-green-128gb-sm-s911bzgbmea/,Samsung Galaxy S23 official/business specifications page,official_vendor_product_specs,Samsung,2026-06-22,Galaxy S23 device specifications,"Galaxy S23 specs such as CPU speed, display size and resolution.",Regional product SKU page; not exhaustive for all model variants.
src.samsung.galaxy_s23_support,https://www.samsung.com/ae/support/model/SM-S911BZACMEA/,Samsung Galaxy S23 support page,official_vendor_support,Samsung,2026-06-22,"Galaxy S23 support, software update and troubleshooting topics",Support page exists for Galaxy S23 model family and includes software-upgrade/support topics.,Support page is regional; exact firmware builds are not listed as Odin packages.
src.samsung.smart_switch_update,https://www.samsung.com/levant/support/mobile-devices/how-to-update-software-using-smart-switch/,Samsung Smart Switch software update instructions,official_vendor_support,Samsung,2026-06-22,Official Samsung software update path using Smart Switch,Smart Switch computer version can update the device with latest software.,Not a complete firmware build index; not a dump archive.
src.samfw.sm_s911b_index,https://samfw.com/firmware/SM-S911B,SamFW Galaxy S23 SM-S911B firmware index,third_party_firmware_metadata,SamFW,2026-06-22,SM-S911B firmware listing seed,Third-party index for SM-S911B firmware packages.,"Discovery/source metadata only; binary safety, legality, authenticity and flash suitability require separate verification."
src.samfw.sm_s911b.mob.s911bxxs9ezc1,https://samfw.com/firmware/SM-S911B/MOB/S911BXXS9EZC1,SamFW SM-S911B MOB S911BXXS9EZC1 metadata,third_party_firmware_metadata,SamFW,2026-06-22,"Firmware/dump metadata for SM-S911B, CSC MOB","PDA S911BXXS9EZC1, CSC MOB, Android 16, size 13.9 GB.",Do not rehost; do not mark package safe or compatible without device/revision/region and verification.
src.samfw.sm_s911b.com.s911bxxsafze1,https://samfw.com/firmware/SM-S911B/COM/S911BXXSAFZE1,SamFW SM-S911B COM S911BXXSAFZE1 metadata,third_party_firmware_metadata,SamFW,2026-06-22,"Firmware/dump metadata for SM-S911B, CSC COM","AP S911BXXSAFZE1, CSC S911BOWOAFZE1, Android 16, One UI 8.5, size 15.06 GB, MD5 listed.",Do not rehost; listed MD5 alone is not full authenticity proof.
src.samfrew.sm_s911b.btb.s911bxxu8dyd9,https://samfrew.com/download/Galaxy__S23__/4x6m/BTB/S911BXXU8DYD9/S911BOXM8DYD9,SamFrew SM-S911B BTB S911BXXU8DYD9 metadata,third_party_firmware_metadata,SamFrew,2026-06-22,"Firmware/dump metadata for SM-S911B, CSC BTB","PDA S911BXXU8DYD9, CSC S911BOXM8DYD9, UK, Android 15, changelist and size metadata.",SamFrew warns flashing firmware can brick the device; treat as high-risk metadata only.
